de,uk,en,topic,level
"Obwohl das Wasser kalt war, hatte er viel Spaß beim Schwimmen.","Хоча вода була холодною, він отримав велике задоволення від плавання.","Although the water was cold, he had a lot of fun swimming.",Swimming & Water Sports,B2
"Die U-Bahn, die pünktlich sein sollte, hatte leider zwanzig Minuten Verspätung.","На жаль, поїзд метро, який повинен був прибути вчасно, запізнився на двадцять хвилин.","The subway, which was supposed to be on time, was unfortunately twenty minutes late.",Public Transport,B2
Das Leben in der Stadt bringt sowohl Vorteile als auch Nachteile mit sich.,"Життя в місті має як переваги, так і недоліки.",City life brings both advantages and disadvantages.,City Life,B2
"Um Stress abzubauen, ist es üblich, dass man regelmäßig Yoga macht.","Щоб зняти стрес, зазвичай регулярно займаються йогою.","To reduce stress, it is common to practice yoga regularly.",Stress & Relaxation,B2
"In Zukunft werden Roboter in der Lage sein, viele Arbeiten selbstständig zu erledigen.",У майбутньому роботи зможуть самостійно виконувати багато робіт.,"In the future, robots will be able to perform many tasks independently.",Robots,B2
